{
  "$schema": "http://json-schema.org/draft-07/schema#",
  "$id": "https://relic-oss.dev/schemas/interaction_policy_pack/v1",
  "title": "Interaction Policy Pack",
  "description": "Interaction policy artifact describing interaction rules and context requirements.",
  "type": "object",
  "required": [
    "id",
    "schema_version",
    "checksum",
    "source_snapshot_id",
    "correction_cutoff",
    "policy_type",
    "rules"
  ],
  "additionalProperties": false,
  "properties": {
    "id": {
      "type": "string",
      "format": "uuid",
      "description": "Unique policy identifier"
    },
    "schema_version": {
      "$ref": "#/definitions/schema_version"
    },
    "checksum": {
      "type": "string",
      "pattern": "^[a-f0-9]{64}$",
      "description": "SHA-256 checksum of policy content"
    },
    "source_snapshot_id": {
      "type": "string",
      "format": "uuid",
      "description": "Reference to source snapshot (REQUIRED)"
    },
    "lineage_refs": {
      "type": "array",
      "description": "Parent artifacts for lineage tracking",
      "items": {
        "$ref": "#/definitions/lineage_ref"
      },
      "default": []
    },
    "correction_cutoff": {
      "$ref": "#/definitions/correction_cutoff"
    },
    "policy_type": {
      "type": "string",
      "enum": [
        "roleplay",
        "factual",
        "creative",
        "high_stakes",
        "mixed"
      ],
      "description": "Type of interaction policy"
    },
    "rules": {
      "type": "array",
      "description": "Interaction rules",
      "items": {
        "type": "object",
        "required": ["rule_id", "action", "condition"],
        "properties": {
          "rule_id": {
            "type": "string",
            "description": "Unique rule identifier"
          },
          "action": {
            "type": "string",
            "enum": [
              "allow",
              "deny",
              "modify",
              "escalate",
              "log"
            ],
            "description": "Action to take"
          },
          "condition": {
            "type": "object",
            "description": "Condition that triggers this rule",
            "properties": {
              "type": {
                "type": "string"
              },
              "operator": {
                "type": "string"
              },
              "value": {
                "type": ["string", "number", "boolean", "null"]
              }
            }
          },
          "priority": {
            "type": "integer",
            "minimum": 0,
            "description": "Rule priority (higher = more important)"
          },
          "metadata": {
            "type": "object",
            "description": "Rule metadata"
          }
        }
      }
    },
    "context_requirements": {
      "type": "object",
      "description": "Context requirements for policy evaluation",
      "default": {},
      "properties": {
        "min_context_tokens": {
          "type": "integer",
          "minimum": 0
        },
        "max_context_tokens": {
          "type": "integer",
          "minimum": 0
        },
        "required_fields": {
          "type": "array",
          "items": {
            "type": "string"
          }
        },
        "forbidden_fields": {
          "type": "array",
          "items": {
            "type": "string"
          }
        }
      }
    },
    "metadata": {
      "type": "object",
      "default": {},
      "description": "Additional metadata"
    },
    "created_at": {
      "type": "string",
      "format": "date-time",
      "description": "Creation timestamp"
    }
  },
  "definitions": {
    "schema_version": {
      "type": "object",
      "required": ["major", "minor", "patch", "schema_uri"],
      "properties": {
        "major": {
          "type": "integer",
          "minimum": 0
        },
        "minor": {
          "type": "integer",
          "minimum": 0
        },
        "patch": {
          "type": "integer",
          "minimum": 0
        },
        "schema_uri": {
          "type": "string",
          "format": "uri"
        }
      }
    },
    "lineage_ref": {
      "type": "object",
      "required": ["artifact_id", "artifact_type", "relationship"],
      "properties": {
        "artifact_id": {
          "type": "string",
          "format": "uuid"
        },
        "artifact_type": {
          "type": "string",
          "enum": ["runtime_profile", "agent_embodiment", "interaction_policy"]
        },
        "relationship": {
          "type": "string",
          "enum": ["derived_from", "supersedes", "references"]
        },
        "created_at": {
          "type": "string",
          "format": "date-time"
        }
      }
    },
    "correction_cutoff": {
      "type": "object",
      "required": ["cutoff_timestamp"],
      "properties": {
        "cutoff_timestamp": {
          "type": "string",
          "format": "date-time"
        },
        "corrections_applied": {
          "type": "array",
          "items": {
            "type": "string",
            "format": "uuid"
          },
          "default": []
        },
        "corrections_pending": {
          "type": "array",
          "items": {
            "type": "string",
            "format": "uuid"
          },
          "default": []
        },
        "verified": {
          "type": "boolean",
          "default": false
        }
      }
    }
  },
  "examples": [
    {
      "id": "770e8400-e29b-41d4-a716-446655440000",
      "schema_version": {
        "major": 1,
        "minor": 0,
        "patch": 0,
        "schema_uri": "https://relic-oss.dev/schemas/interaction_policy_pack/v1"
      },
      "checksum": "c3d4e5f6789012345678901234567890abcdef1234567890abcdef1234567ab",
      "source_snapshot_id": "770e8400-e29b-41d4-a716-446655440001",
      "lineage_refs": [],
      "correction_cutoff": {
        "cutoff_timestamp": "2024-01-15T10:30:00Z",
        "corrections_applied": [],
        "corrections_pending": [],
        "verified": true
      },
      "policy_type": "roleplay",
      "rules": [
        {
          "rule_id": "r1",
          "action": "deny",
          "condition": {
            "type": "sensitive_topic",
            "operator": "contains",
            "value": "medical"
          },
          "priority": 100
        },
        {
          "rule_id": "r2",
          "action": "log",
          "condition": {
            "type": "hint_type",
            "operator": "equals",
            "value": "disputed"
          },
          "priority": 50
        }
      ],
      "context_requirements": {
        "min_context_tokens": 100,
        "max_context_tokens": 4000,
        "required_fields": ["session_id", "correction_cutoff"],
        "forbidden_fields": ["raw_chat", "raw_prompts"]
      },
      "metadata": {},
      "created_at": "2024-01-15T10:30:00Z"
    }
  ]
}
