{
  "id": "770e8400-e29b-41d4-a716-446655440001",
  "schema_version": {
    "major": 1,
    "minor": 0,
    "patch": 0,
    "schema_uri": "https://relic-oss.dev/schemas/interaction_policy_pack/v1"
  },
  "checksum": "c3d4e5f6789012345678901234567890abcdef1234567890abcdef1234567ab",
  "source_snapshot_id": "770e8400-e29b-41d4-a716-446655440010",
  "lineage_refs": [],
  "correction_cutoff": {
    "cutoff_timestamp": "2024-01-15T10:30:00Z",
    "corrections_applied": [],
    "corrections_pending": [],
    "verified": true
  },
  "policy_type": "roleplay",
  "rules": [
    {
      "rule_id": "r1",
      "action": "deny",
      "condition": {
        "type": "sensitive_topic",
        "operator": "contains",
        "value": "medical"
      },
      "priority": 100,
      "metadata": {}
    },
    {
      "rule_id": "r2",
      "action": "log",
      "condition": {
        "type": "hint_type",
        "operator": "equals",
        "value": "disputed"
      },
      "priority": 50,
      "metadata": {}
    }
  ],
  "context_requirements": {
    "min_context_tokens": 100,
    "max_context_tokens": 4000,
    "required_fields": ["session_id", "correction_cutoff"],
    "forbidden_fields": ["raw_chat", "raw_prompts"]
  },
  "metadata": {},
  "created_at": "2024-01-15T10:30:00Z"
}
